{
  "$schema": "https://raw.githubusercontent.com/YOUR_USER/zaati-os/v0.1.1/schemas/data-repository.schema.json",
  "contract_version": "0.1.1",
  "code_repository": "YOUR_USER/zaati-os",
  "code_ref": "v0.1.1",
  "workflow_id": "daily-core",
  "expected_source_ids": ["agenda:primary", "inbox:attention", "work:focus", "money:pulse", "news:briefing", "overview:daily"],
  "snapshot_encryption": false
}
